Date;Days Since Featured;Medium;Technology;Theme;link;scraped_at;subtitle;title;url;Title
2018-01-01;36;Visulization;t-SNE;Music;https://twitter.com/pkmital/status/1043583454632239104;2020-12-02 00:59:14;Extract features from 4.7M audio segments and create a tool to play and visualize the audio files;Parag K. Mital;https://mlart.co/item/extract-features-from-4_7m-audio-segments-and-create-a-tool-to-play-and-visualize-the-audio-files;
2018-01-01;36;Book;['RNN', 'CNN', 'Image Captioning', 'Camera'];Language;https://www.youtube.com/watch?v=TqsW0PMd8R0&feature=emb_logo&ab_channel=OscillatorMedia;2020-12-02 00:59:21;Put a camera on a car to create a road trip novel, by translating CNN features to text, and using it as a prompt for a text generating model;Ross Goodwin;https://mlart.co/item/put-a-camera-on-a-car-to-create-a-road-trip-novel_-by-translating-cnn-features-to-text_-and-using-it-as-a-prompt-for-a-text-generating-model;
2018-01-01;36;Video;['RNN', 'LSTM', 'Deep Fakes'];['Movies', 'Culture'];https://www.youtube.com/watch?v=vUgUeFu2Dcw&feature=emb_title&ab_channel=ArsTechnica;2020-12-02 00:59:28;Augment and cut an exiting film with an LSTM generated screenplay, voice synthesis, and face-swapping;Ross Goodwin, Oscar Sharp;https://mlart.co/item/augment-and-cut-an-exiting-film-with-an-lstm-generated-screenplay_-voice-synthesis_-and-face-swapping;
2018-07-01;30;Video projection;['StyleTransfer', 'Multi-Style Transfer'];Architecture;https://vimeo.com/296891128;2020-12-02 00:59:35;Recurrent application of Style Tranfer and 3D videomapping projected on building;Vadim Epstein;https://mlart.co/item/recurrent-application-of-style-tranfer-and-3d-videomapping-projected-on-building-;
2017-10-01;36;GIF;['DeepDream', 'Gradient Smoothing'];Art;https://twitter.com/genekogan/status/918501190106796037;2020-12-02 00:59:43;Apply Gradient Smoothing to create an infinite pattern from DeepDream;Gene Kogan;https://mlart.co/item/apply-gradient-smoothing-to-create-an-infinite-pattern-from-deepdream;
2018-01-01;36;Video;['Style Transfer', 'Contentless'];['Art', 'Nature'];https://vimeo.com/246047871;2020-12-02 00:59:49;Video texture synthesis using contentless Style Transfer;Gene Kogan;https://mlart.co/item/video-texture-synthesis-using-contentless-style-transfer;
2017-01-01;36;Image;['GAN', 'DCGAN'];['Art', 'Renaissance'];https://github.com/robbiebarrat/art-DCGAN;2020-12-02 00:59:57;GAN-generated Renaissance paintings using the WikiArt dataset;Robbie Barrat;https://mlart.co/item/gan-generated-renaissance-paintings-using-the-wikiart-dataset;
2017-01-01;36;Video;['pix2pix', 'GAN'];['Art', 'Horror'];https://twitter.com/quasimondo/status/817382760037945344;2020-12-02 01:00:04;A next frame prediction using pix2pix feeding the newly generated image repeatedly;Mario Klingemann;https://mlart.co/item/a-next-frame-prediction-using-pix2pix-feeding-the-newly-generated-image-repeatedly;
2017-01-01;36;Web App;['pix2pix', 'GAN'];Culture;https://affinelayer.com/pixsrv/;2020-12-02 01:00:47;Turn a drawing into a cat in a web browser;Christopher Hesse;https://mlart.co/item/turn-a-drawing-into-a-cat-in-a-web-browser;
2017-01-01;36;Lyrics;RNN;Music;https://www.nme.com/news/music/teenager-builds-rapping-ai-using-kanye-west-lyrics-2020222;2020-12-02 01:00:55;Kanye West RNN lyrics generator;Robbie Barrat;https://mlart.co/item/kanye-west-rnn-lyrics-generator;
2017-01-01;36;Web App;['RNN', 'QuickDraw'];Culture;https://arxiv.org/abs/1704.03477;2020-12-02 01:01:02;Generative vector doodles with an RNN;David Ha, Douglas Eck;https://mlart.co/item/generative-vector-doodles-with-an-rnn;
2017-01-01;36;Image;['CNN', 'NNS'];['Culture', 'Media'];https://twitter.com/dribnet/status/864727561544228864;2020-12-02 01:01:09;Pairing New Yorker front-pages by measuring the distance from features extracted from a CNN;Tom White;https://mlart.co/item/pairing-new-yorker-front-pages-by-measuring-the-distance-from-features-extracted-from-a-cnn;
2017-01-01;36;Video;Style Transfer;['Art', 'Glitch'];https://twitter.com/prostheticknowl/status/935284924713717761?s=20;2020-12-02 01:01:17;Apply Slic Superpixels and Style2Paint to Jacob Sutton's music video;Lulu xXX, Jacob Sutton;https://mlart.co/item/apply-slic-superpixels-and-style2paint-to-jacob-sutton_s-music-video;
2017-01-01;36;Web App;['RNN', 'NNS'];Design;https://www.blog.google/topics/machine-learning/fast-drawing-everyone/;2020-12-02 01:01:25;Classifies drawings and matches them with professional graphics;Dan Motzenbecker and Kyle Phillips, Google Creative Lab;https://mlart.co/item/classifies-drawings-and-matches-them-with-professional-graphics;
2017-01-01;36;['Web App', 'Game'];['CNN', 'Classification'];Culture;https://experiments.withgoogle.com/quick-draw;2020-12-02 01:01:31;A user is challenged to draw an object and a CNN model tells if you are correct;Jonas Jongejan, Henry Rowley, Takashi Kawashima, Jongmin Kim, Nick Fox-Gieg, Google Creative Lab;https://mlart.co/item/a-user-is-challenged-to-draw-an-object-and-a-cnn-model-tells-if-you-are-correct;
2017-01-01;36;App;['CNN', 'Translation'];Culture;https://experiments.withgoogle.com/thing-translator;2020-12-02 01:01:39;Take a picture of something to hear how to say it in a different language;Dan Motzenbecker, Google Creative Lab;https://mlart.co/item/take-a-picture-of-something-to-hear-how-to-say-it-in-a-different-language;
2017-01-01;36;Web App;['RNN', 'Magenta'];Music;https://experiments.withgoogle.com/ai-duet;2020-12-02 01:02:10;A user plays a few keys on a piano and an RNN model generates more according to your input;Yotam Mann, Google Creative Lab;https://mlart.co/item/a-user-plays-a-few-keys-on-a-piano-and-an-rnn-model-generates-more-according-to-your-input;
2017-01-01;36;['Visualization', 'Web App'];RNN;Nature;https://experiments.withgoogle.com/ai/bird-sounds/view/;2020-12-02 01:02:17;Thousands of bird sounds visualized using an RNN model;Manny Tan, Kyle McDonald, Google Creative Lab;https://mlart.co/item/thousands-of-bird-sounds-visualized-using-an-rnn-model;
2017-01-01;36;Web App;RNN;Culture;https://experiments.withgoogle.com/handwriting-with-a-neural-net;2020-12-02 01:02:29;An RNN model generates handwriting based on your style;Shan Carter, David Ha, Ian Johnson, Chris Olah, Google Creative Lab;https://mlart.co/item/an-rnn-model-generates-handwriting-based-on-your-style;
2017-01-01;36;Web App;['VAE', 'Magenta'];Music;https://experiments.withgoogle.com/sound-maker;2020-12-02 01:02:36;A tool to mix the latent space of two instruments;Yotam Mann, Google Creative Lab;https://mlart.co/item/a-tool-to-mix-the-latent-space-of-two-instruments;
2017-01-01;36;['Web App', 'Visualization'];t-SNE;Music;https://experiments.withgoogle.com/drum-machine;2020-12-02 01:02:44;A visual map of drum sound made by extracting the features and clustering them with t-SNE;Manny Tan, Kyle McDonald, Google Creative Lab;https://mlart.co/item/a-visual-map-of-drum-sound-made-by-extracting-the-features-and-clustering-them-with-t-sne;
2017-01-01;36;Device;['CNN', 'Hardware'];['Culture', 'Education'];https://experiments.withgoogle.com/objectifier-spatial-programming;2020-12-02 01:02:59;A CNN model in a device that collects data and is auto trained to make an action;Bjørn Karmann, Google Creative Lab;https://mlart.co/item/a-cnn-model-in-a-device-that-collects-data-and-is-auto-trained-to-make-an-action;
2017-01-01;36;Visualization;t-SNE;Education;https://experiments.withgoogle.com/visualizing-high-dimensional-space;2020-12-02 01:03:07;Generates a 3D t-SNE map to visualize high-dimensional data;Daniel Smilkov, Fernanda Viégas, Martin Wattenberg, the Big Picture team, Google Creative Lab;https://mlart.co/item/generates-a-3d-t-sne-map-to-visualize-high-dimensional-data;
2017-01-01;36;Web App;RNN;Culture;https://experiments.withgoogle.com/sketch-rnn-demo;2020-12-02 01:03:14;An RNN model generates doodles based on your style;David Ha, Jonas Jongejan, Ian Johnson, Google Creative Lab;https://mlart.co/item/an-rnn-model-generates-doodles-based-on-your-style;
2017-01-01;36;Web App;['RNN', 'NNS'];Design;https://experiments.withgoogle.com/font-map;2020-12-02 01:03:21;Measure the distance between CNN features to pair fonts;Kevin Ho, Google Creative Lab;https://mlart.co/item/measure-the-distance-between-cnn-features-to-pair-fonts;
2017-01-01;36;Open Source;RNN;Music;https://experiments.withgoogle.com/nsynth-super;2020-12-02 01:03:28;Making music using new sounds generated with machine learning;Magenta, Google Creative Lab;https://mlart.co/item/making-music-using-new-sounds-generated-with-machine-learning;
2017-01-01;36;['Device', 'Game'];['ANN', 'Hardware'];Culture;https://experiments.withgoogle.com/rock-paper-scissors;2020-12-02 01:03:35;Rock-Paper-Scissors game based on a robot with sensors, an ANN classifies the sensory data;Kaz Sato, Google Creative Lab;https://mlart.co/item/rock-paper-scissors-game-based-on-a-robot-with-sensors_-an-ann-classifies-the-sensory-data;
2017-01-01;36;['Visualization', 'Web App'];['CNN', 'Camera'];Education;https://experiments.withgoogle.com/what-neural-nets-see;2020-12-02 01:03:42;Visualize the layers of a CNN with your camera;Gene Kogan;https://mlart.co/item/visualize-the-layers-of-a-cnn-with-your-camera;
2017-01-01;36;Image;GAN;Architecture;http://www.aiartonline.com/design/318/;2020-12-02 01:03:49;GAN generated images of architecture plans;Tyler Kvochick;https://mlart.co/item/gan-generated-images-of-architecture-plans;
2017-01-01;36;Installation;['GAN', 'Discriminator'];Art;http://salavon.com/work/genmo/media/42/;2020-12-02 01:04:13;Reconstruct images by introploating a collage of GANs and guiding it with a GAN discriminator;Jason Salavon;https://mlart.co/item/reconstruct-images-by-introploating-a-collage-of-gans-and-guiding-it-with-a-gan-discriminator;
2017-01-01;36;Video;pix2pix;Nature;http://www.aiartonline.com/community/damien-henry/;2020-12-02 01:04:20;Pix2pix repeatedly takes the generated output as the new input to create a one-hour long video of train windows;Damien Henry;https://mlart.co/item/pix2pix-repeatedly-takes-the-generated-output-as-the-new-input-to-create-a-one-hour-long-video-of-train-windows;
2017-01-01;36;Web App;['t-SNE', 'CNN'];Culture;https://experiments.withgoogle.com/curator-table;2020-12-02 01:04:27;Organise the features of an image with t-SNE, and visualize the similarity between artworks;Cyril Diagne, Simon Doury, Google Arts & Culture Lab;https://mlart.co/item/organise-the-features-of-an-image-with-t-sne_-and-visualize-the-similarity-between-artworks;
2017-01-01;36;['Image', 'Open Source'];Style Transfer;Art;https://github.com/alexjc/neural-doodle;2020-12-02 01:04:34;Translate two-bit doodles into paintings with Semantic Style Transfer;Alex J. Champandard;https://mlart.co/item/translate-two-bit-doodles-into-paintings-with-semantic-style-transfer;
2017-01-01;36;Open Source;['Image Captioning', 'pix2code', 'RNN', 'LSTM', 'CNN'];Web;https://arxiv.org/abs/1705.07962;2020-12-02 01:04:41;Translate image features from a graphical user interface to RNN generated website;Tony Beltramelli;https://mlart.co/item/translate-image-features-from-a-graphical-user-interface-to-rnn-generated-website;
2017-01-01;36;Video;['CNN', 'Classification', 'Camera'];Web;https://airbnb.design/sketching-interfaces/;2020-12-02 01:04:48;Use a CNN to classify low fidelity wireframes to mobile app components;Benjamin Wilkins, J.H. Gold;https://mlart.co/item/use-a-cnn-to-classify-low-fidelity-wireframes-to-mobile-app-components;
2017-01-01;36;Image;['Style Transfer', 'Texture synthesis'];Texture;http://www.aiartonline.com/community/xavier-snelgrove/;2020-12-02 01:04:54;Create a texture by combining two images with Style Transfer;Xavier Snelgrove;https://mlart.co/item/create-a-texture-by-combining-two-images-with-style-transfer;
2017-01-01;36;Image;['GAN', 'Weights'];Art;http://www.aiartonline.com/art/mario-klingemann/;2020-12-02 01:05:12;Deleting weights in GANs to create glitches;Mario Klingemann;https://mlart.co/item/deleting-weights-in-gans-to-create-glitches;
2017-01-01;36;Image;['GAN', 'pix2pix', 'Expression Detection'];Art;http://underdestruction.com/2017/07/23/freeda-beast-bringing-things-to-an-end/;2020-12-02 01:05:19;Extract face markers and use a pix2pix model to translate the face markers into paintings;Mario Klingemann;https://mlart.co/item/extract-face-markers-and-use-a-pix2pix-model-to-translate-the-face-markers-into-paintings;
2017-01-01;36;Installation;['PoseNet', 'pix2pix', 'GAN'];Art;https://albertbarque.com/myartificialmuse/;2020-12-02 01:05:26;Generate a pose, use a pix2pix model to turn the pose into an artwork and then paint it live;Mario Klingemann, Albert Barqué-Duran;https://mlart.co/item/generate-a-pose_-use-a-pix2pix-model-to-turn-the-pose-into-an-artwork-and-then-paint-it-live;
2017-01-01;36;Video;['GAN', 'pix2pix'];['Media', 'Art'];https://www.youtube.com/watch?v=af_9LXhcebY&feature=emb_title;2020-12-02 01:05:33;Create a deep fake with Kellyanne Conway's by translating face markers into a video of a person speaking;Mario Klingemann;https://mlart.co/item/create-a-deep-fake-with-kellyanne-conway_s-by-translating-face-markers-into-a-video-of-a-person-speaking;
2017-01-01;36;['Installation', 'Music', 'Sketch'];['t-SNE', 'CNN', 'Classification', 'Camera', 'Device'];Art;http://annaridler.com/drawing-with-sound;2020-12-02 01:05:40;Organise personal art collection with t-SNE, compose music according to each clusters, and detect each clusters with a camera to play corresponding music;Anna Ridler, Ben Heim;https://mlart.co/item/organise-personal-art-collection-with-t-sne_-compose-music-according-to-each-clusters_-and-detect-each-clusters-with-a-camera-to-play-corresponding-music;
2017-01-01;36;Image;GAN;['Art', 'Litterature'];http://annaridler.com/fall-of-the-house-of-usher-ii;2020-12-02 01:05:48;A GAN trained on handmade ink drawings based on the film Fall of the House of Usher (1929) as well as the GAN-generated images themselves;Anna Ridler;https://mlart.co/item/a-gan-trained-on-handmade-ink-drawings-based-on-the-film-fall-of-the-house-of-usher-_1929_-as-well-as-the-gan-generated-images-themselves;
2017-01-01;36;Video;['GAN', 'Pix2pix', 'Camera'];['Culture', 'Politics'];https://twitter.com/genekogan/status/857922705412239362;2020-12-02 01:05:54;Translate a live face to face trackers and turn them into a another person with Pix2pix;Gene Kogan;https://mlart.co/item/translate-a-live-face-to-face-trackers-and-turn-them-into-a-another-person-with-pix2pix;
2017-01-01;36;Installation;['RNN', 'LSTM'];['Art', 'Abstract'];https://sougwen.com/project/drawingoperations-memory;2020-12-02 01:06:01;Train an RNN on drawing motions and create a painting in collaboration with a robot arm controlled by the model;Sougwen Chung;https://mlart.co/item/train-an-rnn-on-drawing-motions-and-create-a-painting-in-collaboration-with-a-robot-arm-controlled-by-the-model;
2017-01-01;36;Video;['RNN', 'Image Captioning', 'CNN', 'GAN'];['Art', 'Abstract'];https://www.jakeelwes.com/project-closedLoop.html;2020-12-02 01:06:22;Use an image captioning model that translates CNN features to RNN features, and another GAN that translates RNN features to images in a loop;Jake Elwes;https://mlart.co/item/use-an-image-captioning-model-that-translates-cnn-features-to-rnn-features_-and-another-gan-that-translates-rnn-features-to-images-in-a-loop;
2017-01-01;36;Image;GAN;Art;http://www.miketyka.com/?s=faces;2020-12-02 01:06:30;A GAN trained on faces from Flickr;Mike Tyka;https://mlart.co/item/a-gan-trained-on-faces-from-flickr;
2017-01-01;36;Installation;['GAN', 'UMAP'];['History', 'Culture'];http://www.miketyka.com/?p=salt;2020-12-02 01:06:38;Train a GAN on historical documents from SALT Research and display the interpolation on multiple screens;Mike Tyka, Refik Anadol;https://mlart.co/item/train-a-gan-on-historical-documents-from-salt-research-and-display-the-interpolation-on-multiple-screens;
2017-01-01;36;Image;['ANN', 'Image Captioning', 'RNN', 'CNN'];['Art', 'Abstract'];http://www.memo.tv/works/learning-to-dream-supergan/;2020-12-02 01:06:45;Generated by two neural networks recursively upscaling itself and generating the titles with an image captioning model;Memo Akten;https://mlart.co/item/generated-by-two-neural-networks-recursively-upscaling-itself-and-generating-the-titles-with-an-image-captioning-model;
2017-01-01;36;Screenplay;['RNN', 'LSTM'];Language;https://www.youtube.com/watch?v=5qPgG98_CQ8&ab_channel=ArsTechnica;2020-12-02 01:06:53;An LSTM generated screenplay trained on screenplays from several films and television series, and produced according to the screenplay;Ross Goodwin, Oscar Sharp;https://mlart.co/item/an-lstm-generated-screenplay-trained-on-screenplays-from-several-films-and-television-series_-and-produced-according-to-the-screenplay;
2016-01-01;36;['Image', 'Tutorial'];['CPPN', 'ANN'];['Art', 'Abstract', 'Education'];https://blog.otoro.net/2016/03/25/generating-abstract-patterns-with-tensorflow/;2020-12-02 01:07:00;Use a CPPN to create shader-like images including a tutorial;David Ha;https://mlart.co/item/use-a-cppn-to-create-shader-like-images-including-a-tutorial;
2016-01-01;36;Video;['DenseCap', 'DeepDream'];Culture;https://vimeo.com/173062236;2020-12-02 01:07:07;Continuously zoom in a image and apply DeepDream and use Dense Captioning to label objects in the video;Gene Kogan;https://mlart.co/item/continuously-zoom-in-a-image-and-apply-deepdream-and-use-dense-captioning-to-label-objects-in-the-video;
2016-01-01;36;Installation;['pix2pix', 'GAN', 'Device'];['Art', 'Maps'];https://opendot.github.io/ml4a-invisible-cities/;2020-12-02 01:07:14;A Conditional GAN trained on OpenStreetMap's map and corresponding satellite image inspired by Italo Calvino's Invisible Cities;Gene Kogan;https://mlart.co/item/a-conditional-gan-trained-on-openstreetmap_s-map-and-corresponding-satellite-image-inspired-by-italo-calvino_s-invisible-cities;
2016-01-01;36;Installation;['CNN', 'Classification', 'openFrameworks', 'OpenCV', 'Ableton Live'];Music;https://vimeo.com/197026662;2020-12-02 01:07:37;Use a CNN to classify instruments in a live drawing and add the instrument tracks in Ableton Live to compose in real-time;Andreas Refsgaard, Gene Kogan;https://mlart.co/item/use-a-cnn-to-classify-instruments-in-a-live-drawing-and-add-the-instrument-tracks-in-ableton-live-to-compose-in-real-time;
2016-01-01;36;Image;['DeepDream', 'Gradient Ascent'];Art;https://grayarea.org/press/inside-googles-first-deepdream-art-show/;2020-12-02 01:07:44;DeepDream applied to the face of a woman;Mario Klingemann;https://mlart.co/item/deepdream-applied-to-the-face-of-a-woman;
2016-01-01;36;Image;['DeepDream', 'Gradient Ascent'];Art;http://www.memo.tv/works/all-watched-over-by-machines-of-loving-grace-deepdream-edition/;2020-12-02 01:07:51;DeepDream applied to a satellite image of Google's headquarters;Memo Aktken;https://mlart.co/item/deepdream-applied-to-a-satellite-image-of-google_s-headquarters;
2016-01-01;36;Image;['DeepDream', 'Gradient Ascent', 'Laplacian Pyramid'];Art;https://grayarea.org/press/inside-googles-first-deepdream-art-show/;2020-12-02 01:07:58;DeepDream with Laplacian Pyramid Gradient Normalization;Alexander Mordvintsev;https://mlart.co/item/deepdream-with-laplacian-pyramid-gradient-normalization;
2016-01-01;36;Image;['DeepDream', 'Gradient Ascent'];Art;https://grayarea.org/press/inside-googles-first-deepdream-art-show/;2020-12-02 01:08:05;DeepDream inspired by Classical Western Art History;Josh Nimoy;https://mlart.co/item/deepdream-inspired-by-classical-western-art-history;
2016-01-01;36;Image;pix2pix;Maps;https://opendot.github.io/ml4a-invisible-cities/;2020-12-02 01:08:12;A Conditional GAN applied on satellite images from OpenStreetMap;Gene Kogan;https://mlart.co/item/a-conditional-gan-applied-on-satellite-images-from-openstreetmap;
2016-01-01;36;Performance;DeepDream;Nature;http://www.miketyka.com/?p=butoh;2020-12-02 01:08:19;Flora and fauna themed DeepDream projection on Kaoru Okomura;Kaoru Okomura, Mike Tyka;https://mlart.co/item/flora-and-fauna-themed-deepdream-projection-on-kaoru-okomura;
2016-01-01;36;Laser Cut Wood;DeepDream;Art;http://www.miketyka.com/?s=deepdream;2020-12-02 01:08:26;DeepDream of Himalayas created with lasercut wood;Mike Tyka;https://mlart.co/item/deepdream-of-himalayas-created-with-lasercut-wood;
2016-01-01;36;Text;Word2Vec;['Language', 'Bias', 'Gender'];http://www.memo.tv/works/wordofmathbias/;2020-12-02 01:08:47;Pick random words from Word2Vec and look at their relationships to the words ‘man’ and ‘woman’;Memo Akten;https://mlart.co/item/pick-random-words-from-word2vec-and-look-at-their-relationships-to-the-words-_man_-and-_woman;
2016-01-01;36;Web App;['CNN', 'NNS'];Maps;http://flong.com/projects/terrapattern/;2020-12-02 01:08:54;Select a region on a map and extract CNN features and use NNS to find similar regions;Golan Levin, David Newbury, Kyle McDonald, Irene Alvarado, Aman Tiwari, Manzil Zaheer;https://mlart.co/item/select-a-region-on-a-map-and-extract-cnn-features-and-use-nns-to-find-similar-regions;
2016-01-01;36;Screenplay;['RNN', 'LSTM'];Language;https://www.youtube.com/watch?v=LY7x2Ihqjmc&ab_channel=ArsTechnica;2020-12-02 01:09:01;An LSTM generated screenplay trained on sci-fi screenplays, and produced according to the screenplay;Ross Goodwin, Oscar Sharp;https://mlart.co/item/an-lstm-generated-screenplay-trained-on-sci-fi-screenplays_-and-produced-according-to-the-screenplay;
2015-01-01;36;Image;['CNN', 'Activations', 'DeepDream', 'Gradient Ascent'];['Art', 'Education'];https://ai.googleblog.com/2015/06/inceptionism-going-deeper-into-neural.html;2020-12-02 01:09:08;Run an image through a pre-trained CNN, and then upscale the image backward. For each layer, adjust the image according to the difference between the activations and the image;Alexander Mordvintsev;https://mlart.co/item/run-an-image-through-a-pre-trained-cnn_-and-then-upscale-the-image-backward_-for-each-layer_-adjust-the-image-according-to-the-difference-between-the-activations-and-the-image;
2015-01-01;36;['Education', 'Tutorial'];['CNN', 'Activations'];['Art', 'DeepDream'];https://distill.pub/2017/feature-visualization/;2020-12-02 01:09:15;Visualize features in a neural network using Gradient Ascent;Alexander Mordvintsev;https://mlart.co/item/visualize-features-in-a-neural-network-using-gradient-ascent;
2015-01-01;36;Image;K-means;['Pop Art', 'Art'];https://blog.otoro.net/2015/09/06/warhol-generator/;2020-12-02 01:09:22;Use K-means to segment and colorize an image, inspired by Warhol;David Ha;https://mlart.co/item/use-k-means-to-segment-and-colorize-an-image_-inspired-by-warhol;
2015-01-01;36;Installation;['StyleTransfer', 'Camera'];Art;https://genekogan.com/works/style-transfer/;2020-12-02 01:09:29;Apply Cubist Style Transfer live with a camera;Gene Kogan;https://mlart.co/item/apply-cubist-style-transfer-live-with-a-camera;
2015-01-01;36;GIF;['DCGAN', 'GAN'];['Language', 'Handwriting'];https://genekogan.com/works/a-book-from-the-sky/;2020-12-02 01:09:36;DCGAN trained on a database of handwritten Chinese Characters;Gene Kogan;https://mlart.co/item/dcgan-trained-on-a-database-of-handwritten-chinese-characters;
2015-01-01;36;Image;['CNN', 'Clustering'];Art;https://www.flickr.com/photos/quasimondo/albums/72157650895011058;2020-12-02 01:09:57;2D cluster arrangement by feature vectors;Mario Klingemann;https://mlart.co/item/2d-cluster-arrangement-by-feature-vectors;
2015-01-01;36;Video;StyleTransfer;['Culture', 'Movies'];https://vimeo.com/139123754;2020-12-02 01:10:04;Apply Style Transfer with 17 different paintings on Alice in Wonderland;Gene Kogan;https://mlart.co/item/apply-style-transfer-with-17-different-paintings-on-alice-in-wonderland;
2015-01-01;30;App;Memory Mosaic;Music;https://vimeo.com/137034067;2020-12-02 01:10:11;A generative audio mashup tool using Memory Mosaic;Parag K. Mital;https://mlart.co/item/a-generative-audio-mashup-tool-using-memory-mosaic;
2014-01-01;36;Instrument;['Device', 'microcontroller', 'openFrameworks', 'ANN'];Music;https://genekogan.com/works/birl/;2020-12-02 01:10:18;Finger pressure sensors, a breath pressure and embouchure sensor on the mouthpiece mapped with an ANN to generate sound via a microcontroller;Gene Kogan, Jeff Snyder;https://mlart.co/item/finger-pressure-sensors_-a-breath-pressure-and-embouchure-sensor-on-the-mouthpiece-mapped-with-an-ann-to-generate-sound-via-a-microcontroller;
2013-01-01;36;Book;N-gram;Language;https://rossgoodwin.com/10000sonnets.pdf;2020-12-02 01:10:24;Use an N-gram model to generate 10 000 sonnets trained on works by William Shakespeare;Ross Goodwin;https://mlart.co/item/use-an-n-gram-model-to-generate-10-000-sonnets-trained-on-works-by-william-shakespeare;
2013-01-01;30;Song;Corpus-based synthesis;Music;https://soundcloud.com/pkmital/sets/michael-jackson-experiments;2020-12-02 01:10:31;Corpus-based audio synthesis on Michael Jackson’s Beat It using Nature Recordings;Parag K. Mital;https://mlart.co/item/corpus-based-audio-synthesis-on-michael-jackson_s-beat-it-using-nature-recordings;
2012-01-01;30;Software;Feature vectors;Music;https://vimeo.com/40130981;2020-12-02 01:10:38;Mining Unlabeled Electronic Music Databases through 3D Interactive Visualization of Latent Component Relationships;Parag K. Mital;https://mlart.co/item/mining-unlabeled-electronic-music-databases-through-3d-interactive-visualization-of-latent-component-relationships;
2011-01-01;36;Image;['SOM', 'ofxSelfOrganizingMap', 'Gaussian Mixture Model'];Color;https://genekogan.com/works/color-of-words/;2020-12-02 01:10:45;Fit a Gaussian mixture model on 100 images of a topic and randomly sample from the model with a self-organizing map to create one image representing the color from the topic;Gene Kogan;https://mlart.co/item/fit-a-gaussian-mixture-model-on-100-images-of-a-topic-and-randomly-sample-from-the-model-with-a-self-organizing-map-to-create-one-image-representing-the-color-from-the-topic;
