Date;Days Since Featured;Medium;Technology;Theme;link;scraped_at;subtitle;title;url;Title
2019-01-17;36;Web App;['CNN', 'RNN', 'Classification', 'Magenta'];Music;https://experiments.withgoogle.com/freddiemeter;2020-12-02 00:35:20;Analyse voice files to match the similarity to Freddie Mercury;Google Research, Google Creative Lab, YouTube Music;https://mlart.co/item/analyse-voice-files-to-match-the-similarity-to-freddie-mercury;
2019-01-18;36;Device;['AutoML', 'CNN', 'Hardware'];Culture;https://experiments.withgoogle.com/teachable-machine;2020-12-02 00:35:28;Device to collect a few categories of data at home and automatically train a model to classify them;Google Creative Lab;https://mlart.co/item/device-to-collect-a-few-categories-of-data-at-home-and-automatically-train-a-model-to-classify-them;
2019-01-19;36;Device;['AutoML', 'CNN', 'Hardware'];Culture;https://experiments.withgoogle.com/tiny-sorter;2020-12-02 00:35:35;Collect dataset and use AutoML to classify the images;Google Creative Lab;https://mlart.co/item/collect-dataset-and-use-automl-to-classify-the-images;
2019-01-20;36;Print;ImageNet;['Culture', 'Technology'];http://salavon.com/work/little-infinity/;2020-12-02 00:35:42;Visualize the entire ImageNet dataset in vertical rows;Jason Salavon;https://mlart.co/item/visualize-the-entire-imagenet-dataset-in-vertical-rows;
2019-01-21;36;Installation;['GAN', 'Camera'];Art;http://salavon.com/work/faceoff-v-inman/grid/67/;2020-12-02 00:35:57;GAN interpolation based on a camera feed;Jason Salavon;https://mlart.co/item/gan-interpolation-based-on-a-camera-feed;
2019-01-22;36;Web App;['Background Removal', 'UMAP'];Fashion;https://experiments.withgoogle.com/business-of-fashion;2020-12-02 00:36:04;Use UMAP to cluster the color of outfits in several thousand catwalks;Cyril Diagne, Google Arts & Culture Lab;https://mlart.co/item/use-umap-to-cluster-the-color-of-outfits-in-several-thousand-catwalks;
2019-01-23;36;Web App;['UMAP', 'PoseNet'];Dance;https://experiments.withgoogle.com/living-archive-wayne-mcgregor;2020-12-02 00:36:26;Use PoseNet to extract a pose and generate stick figure choreographies;Bastien Girschig, Google Arts & Culture Lab;https://mlart.co/item/use-posenet-to-extract-a-pose-and-generate-stick-figure-choreographies;
2019-01-24;36;['Web App', 'Installation'];['RNN', 'Camera'];['Language', 'Poetry'];https://experiments.withgoogle.com/poemportraits;2020-12-02 00:36:33;Generate a poem from a word and project it on your face;Es Devlin, Ross Goodwin, IYOIYO, Google Arts & Culture Lab;https://mlart.co/item/generate-a-poem-from-a-word-and-project-it-on-your-face;
2019-01-25;36;Opera;['pix2pix', 'RNN', 'LSTM', 'Markov Chain', 'OpenPose', 'Detectron'];Opera;http://www.aiartonline.com/art/lingdong-huang-zheng-jiang-giada-sun-tong-bai-eunsu-kang-barnabas-poczos/;2020-12-02 00:36:40;Generate a vintage Chinese opera by extracting poses and augmenting them with a pix2pix model;Lingdong Huang, Zheng Jiang, Giada Sun, Tong Bai, Eunsu Kang, Barnabas Poczos;https://mlart.co/item/generate-a-vintage-chinese-opera-by-extracting-poses-and-augmenting-them-with-a-pix2pix-model;
2019-01-26;36;Video;Style Transfer;Art;http://www.aiartonline.com/highlights/jana-sam-and-alex-mordvintsev/;2020-12-02 00:36:48;Zooming inside of an artwork and applying Style Transfer to transfer to another artwork;Jana Sam, Alexander Mordvintsev;https://mlart.co/item/zooming-inside-of-an-artwork-and-applying-style-transfer-to-transfer-to-another-artwork;
2019-01-27;36;['Video', 'Collage'];GAN;Art;http://www.aiartonline.com/highlights/mario-klingemann-3/;2020-12-02 00:36:56;GAN collage interpolation of three dogs;Mario Klingemann;https://mlart.co/item/gan-collage-interpolation-of-three-dogs;
2019-01-28;36;Song;RNN;Music;http://www.aiartonline.com/music-2019/amber-frid-jimenez/;2020-12-02 00:37:03;RNN generative piano music inspired by Satie;Amber Frid-Jimenez;https://mlart.co/item/rnn-generative-piano-music-inspired-by-satie;
2019-01-29;36;Song;['RNN', 'LSTM'];Music;http://www.aiartonline.com/music-2019/andrew-pfalz-2/;2020-12-02 00:37:10;RNN generated classical music;Andrew Pfalz;https://mlart.co/item/rnn-generated-classical-music;
2019-01-30;36;Installation;['WaveGAN', 'Hardware', 'GAN'];Art;http://www.aiartonline.com/community-2019/eunsu-kang-donald-craig-austin-dill-songwei-ge-barnabas-poczos/;2020-12-02 00:37:17;Use WaveGAN to generate sound based on touch;Eunsu Kang, Donald Craig, Austin Dill, Songwei Ge, Barnabas Poczos;https://mlart.co/item/use-wavegan-to-generate-sound-based-on-touch;
2019-01-01;36;Image;['GAN', 'CycleGAN', 'SNGAN'];Religion;https://computervisionart.com/pieces2019/inferno/;2020-12-02 00:37:38;SNGAN trained on doodles and upscaled and colorized with CycleGAN;Helena Sarin;https://mlart.co/item/sngan-trained-on-doodles-and-upscaled-and-colorized-with-cyclegan;
2019-01-01;36;Video;['Pix2pix', 'GAN'];['Nature', 'Art'];https://shi-weili.com/terra-mars;2020-12-02 00:37:45;A Conditional GAN trained on topographical data and satellite imagery of Earth to terraform Mars topographic data;Shi Weili;https://mlart.co/item/a-conditional-gan-trained-on-topographical-data-and-satellite-imagery-of-earth-to-terraform-mars-topographic-data;
2019-01-01;36;Installation;['RNN', 'LSTM'];['Art', 'Abstract'];https://sougwen.com/project/artefact1;2020-12-02 00:37:52;Train an RNN on drawing motions and create a painting in collaboration where the model has one color and Sougwen Chung has another;Sougwen Chung;https://mlart.co/item/train-an-rnn-on-drawing-motions-and-create-a-painting-in-collaboration-where-the-model-has-one-color-and-sougwen-chung-has-another;
2019-01-01;36;Installation;['RNN', 'LSTM', 'Microphone'];['Language', 'Bias', 'Gender'];https://www.stephaniedinkins.com/ntoo.html;2020-12-02 00:38:00;An RNN trained on oral histories from three generations of women from a single-family to highlight concerns of people who are underrepresented in the tech sector, displayed with an interactive voice assistant;Stephanie Dinkins;https://mlart.co/item/an-rnn-trained-on-oral-histories-from-three-generations-of-women-from-a-single-family-to-highlight-concerns-of-people-who-are-underrepresented-in-the-tech-sector_-displayed-with-an-interactive-voice-assistant;
2019-01-01;36;Video;['BigGAN', 'GAN', 'Music Transformer'];Cities;http://www.miketyka.com/?p=eons;2020-12-02 00:38:07;Create videos with BigGAN and add music with the Music Transformer;Mike Tyka;https://mlart.co/item/create-videos-with-biggan-and-add-music-with-the-music-transformer;
2019-01-01;36;App;GauGAN;Climate Change;https://drive.google.com/file/d/16lRRYapBPttYrLVUDwFPzUYTUfgrk3q0/view;2020-12-02 00:38:15;Use GauGAN with sliders and segment animations, adjusting the landscape to raise awareness of climate change;Fabin Rasheed;https://mlart.co/item/use-gaugan-with-sliders-and-segment-animations_-adjusting-the-landscape-to-raise-awareness-of-climate-change;
2019-01-01;36;Video;GAN;['Music', 'Art', 'Nature'];https://vimeo.com/neuralsynesthesia;2020-12-02 00:38:22;Visualizing sound by interpolating a GAN trained on microscope images;Xander Steenbrugge;https://mlart.co/item/visualizing-sound-by-interpolating-a-gan-trained-on-microscope-images;
2019-01-01;36;Performance;['GAN', 'Height map'];['Emotions', 'Culture'];https://albertbarque.com/ultimateemoji/;2020-12-02 00:38:29;Use a 3D GAN to generate an Emoji, 3D print the generated Emoji, and paint it during a live performance;Albert Barqué-Duran;https://mlart.co/item/use-a-3d-gan-to-generate-an-emoji_-3d-print-the-generated-emoji_-and-paint-it-during-a-live-performance;
2019-01-01;36;Web App;['GAN', 'Interpolation', 'Feature Mixing'];Art;https://artbreeder.com/;2020-12-02 00:38:51;A collaborative art tool for mixing the latent space of different GAN models to produce new artworks;Joel Simon;https://mlart.co/item/a-collaborative-art-tool-for-mixing-the-latent-space-of-different-gan-models-to-produce-new-artworks;
2019-01-01;36;Sculpture;['GAN', 'cDCGAN'];Language;https://joelsimon.net/tablets.html;2020-12-02 00:38:57;Use a word vector to generate an image, and a discriminator to detect the word vector from the generated image, made by CNCing unfired clay;Joel Simon;https://mlart.co/item/use-a-word-vector-to-generate-an-image_-and-a-discriminator-to-detect-the-word-vector-from-the-generated-image_-made-by-cncing-unfired-clay;
2019-01-01;36;Video;['GAN', 'ESR-GAN', 'StyleGAN'];['Arcitechture', 'Culture'];https://twitter.com/refikanadol/status/1086216491203264512;2020-12-02 00:39:04;A StyleGAN trained on 2 million architecture photos and interpolated;Refik Anadol;https://mlart.co/item/a-stylegan-trained-on-2-million-architecture-photos-and-interpolated;
2019-01-01;36;Song;GPT;Music;https://openai.com/blog/musenet/;2020-12-02 00:39:11;A music generator trained on hundreds of thousands of MIDI files and trained with GPT-2;Christine Payne;https://mlart.co/item/a-music-generator-trained-on-hundreds-of-thousands-of-midi-files-and-trained-with-gpt-2;
2019-01-01;30;Sculpture;['GAN', '3D'];Religion;http://bensnell.io/dio;2020-12-02 00:39:19;A 3D-GAN trained on 1000 sculptures inspired by the Greek god Dionysus;Ben Snell;https://mlart.co/item/a-3d-gan-trained-on-1000-sculptures-inspired-by-the-greek-god-dionysus;Dio
2019-02-01;30;Video;['ProGAN', 'Multi-Style Transfer'];['History', 'Ethnic'];https://vimeo.com/376555746;2020-12-02 00:39:26;Recurrent application of Style Tranfer, then processed by ProGAN;Orkhan Mammadov, Vadim Epstein;https://mlart.co/item/recurrent-application-of-style-tranfer_-then-processed-by-progan;The Idea of saving Aesthetic
2019-07-01;30;Painted canvas;Pix2Pix;['Graffiti', 'Tags'];https://alsino.io/the-amazing-augmented-tagger-machine;2020-12-02 00:39:34;A Conditional GAN trained on a data set of ~1,000 annotated street tag images from Germany. The model can generate new graffiti tags based on any textual input from the audience;Alsino Skowronnek;https://mlart.co/item/a-conditional-gan-trained-on-a-data-set-of-_1_000-annotated-street-tag-images-from-germany_-the-model-can-generate-new-graffiti-tags-based-on-any-textual-input-from-the-audience;Amazing Augmented Tagger Machine
2019-01-01;30;Image;['AttnGAN', 'LSTM', 'FastPhotoStyle'];Art;https://nurecas.com/an-augmented-artist;2020-12-02 00:39:41;An LSTM trained on 350k haikus, the generated Haiku is then translated to an image with AttnGAN and then painted;Fabin Rasheed;https://mlart.co/item/an-lstm-trained-on-350k-haikus_-the-generated-haiku-is-then-translated-to-an-image-with-attngan-and-then-painted;
2018-10-01;36;VR App;['pix2pix', 'VR', 'GAN'];['Horror', 'Culture'];https://www.youtube.com/watch?v=Ab2ChAiLQWk&feature=youtu.be&ab_channel=ZariaJalan;2020-12-02 00:40:02;Draw a face in VR and translate it to a real face with a Conditional GAN;Zaria Howard;https://mlart.co/item/draw-a-face-in-vr-and-translate-it-to-a-real-face-with-a-conditional-gan;
2018-10-01;36;Installation;['RNN', 'Device', 'Microphone'];['Art', 'Language'];https://vivianatroya.com/all-your-diction/;2020-12-02 00:40:09;Two devices that transcribe voice in real-time and an RNN-based model that predict future conversations;Vivian Troya;https://mlart.co/item/two-devices-that-transcribe-voice-in-real-time-and-an-rnn-based-model-that-predict-future-conversations;
2018-07-01;36;Video;['StyleGAN', 'GAN'];Nature;https://twitter.com/erikswahn/status/1284434375413846017;2020-12-02 00:40:16;Four-channel StyleGAN trained on SRTM elevation data;Erik Swahn;https://mlart.co/item/four-channel-stylegan-trained-on-srtm-elevation-data;
2018-02-01;36;Image;['CycleGAN', 'GAN'];Architecture;https://twitter.com/glagolista/status/976876475810017280;2020-12-02 00:40:23;Apply CycleGAN to a Sketch of the Fonthill Castle;Helena Sarin;https://mlart.co/item/apply-cyclegan-to-a-sketch-of-the-fonthill-castle;
2018-12-01;36;Image;Deep Painterly Harmonization;['Art', 'Humor'];https://twitter.com/genekogan/status/1073624934553931776;2020-12-02 00:40:30;Use Deep Painterly Harmonization to add objects to famous paintings;Gene Kogan;https://mlart.co/item/use-deep-painterly-harmonization-to-add-objects-to-famous-paintings;
2018-01-01;36;['App', 'Image'];['CNN', 'NNS', 'Camera'];Art;https://www.blog.google/outreach-initiatives/arts-culture/where-world-your-art-selfie/;2020-12-02 00:40:38;Take a selfie, extract the CNN features, and match them with features from portraits;Google Arts & Culture Lab, Cyril Diagne;https://mlart.co/item/take-a-selfie_-extract-the-cnn-features_-and-match-them-with-features-from-portraits;
2018-01-01;36;GIF;['Depth Map', 'Point Cloud'];['Art', 'Abstract'];https://twitter.com/jonathanfly/status/1174033265524690949;2020-12-02 00:40:45;A CNN model that extracts depth maps from artworks and then augment them in a 3D point cloud;Jonathan Fly;https://mlart.co/item/a-cnn-model-that-extracts-depth-maps-from-artworks-and-then-augment-them-in-a-3d-point-cloud;
2018-01-01;36;Video;Style Transfer;['Art', 'Impressionism'];https://www.youtube.com/watch?v=1PwY-Hfspoc;2020-12-02 00:40:53;Create a video by connecting two paintings with Style Transfer;Alexander Mordvintsev;https://mlart.co/item/create-a-video-by-connecting-two-paintings-with-style-transfer;
2018-01-01;36;['Image', 'Print'];GAN;['Art', 'Renaissance'];https://obvious-art.com/gallery-obvious/;2020-12-02 00:41:14;Storify and auction GAN generated paintings based on Robbie Barrat's model;Obvious;https://mlart.co/item/storify-and-auction-gan-generated-paintings-based-on-robbie-barrat_s-model;
2018-01-01;36;['Tool', 'Education'];['CNN', 'NNS'];Art;http://underdestruction.com/2016/11/05/x-degrees-of-separation-2016/;2020-12-02 00:41:21;Find N artworks that link two artworks;Mario Klingemann, Simon Doury, Google Arts & Culture Lab;https://mlart.co/item/find-n-artworks-that-link-two-artworks;
2018-01-01;36;Print;CNN;['Art', 'Education', 'Abstract'];http://naturemorte.com/exhibitions/gradientdescent/;2020-12-02 00:41:28;A program that generates abstract images and is guided by a trained CNN classifier;Tom White;https://mlart.co/item/a-program-that-generates-abstract-images-and-is-guided-by-a-trained-cnn-classifier;
2018-01-01;36;Video;['U-net', 'Resnet', 'ImageNet', 'pix2pix', 'DeOldify'];['Colorization', 'Movie'];https://github.com/jantic/DeOldify;2020-12-02 00:41:35;Colorize the B&W movie Metropolis with a pix2pix U-Net;Jason Antic;https://mlart.co/item/colorize-the-bandw-movie-metropolis-with-a-pix2pix-u-net;
2018-01-01;36;['Image', 'Open Source'];['U-net', 'Resnet', 'ImageNet', 'pix2pix', 'DeOldify'];Colorization;https://github.com/jantic/DeOldify;2020-12-02 00:41:42;Colorize B&W livingroom in Sweden with a pix2pix U-Net;Jason Antic;https://mlart.co/item/colorize-bandw-livingroom-in-sweden-with-a-pix2pix-u-net;
2018-01-01;36;Real-time Video;['pix2pix', 'Camera', 'GAN'];Art;https://twitter.com/quasimondo/status/982711735001010176;2020-12-02 00:41:48;Turn finger drawings into a GAN generated image;Mario Klingemann;https://mlart.co/item/turn-finger-drawings-into-a-gan-generated-image;
2018-01-01;36;Video;['Transformer', 'GPT'];['Conceptual', 'Minimalism'];https://twitter.com/videodrome/status/1199095612031078400;2020-12-02 00:41:56;GPT-2 to generate a set of rules describing a drawing, inspired by Sol LeWitt;Robbie Barrat;https://mlart.co/item/gpt-2-to-generate-a-set-of-rules-describing-a-drawing_-inspired-by-sol-lewitt;
2018-01-01;36;Video;GAN;['Science', 'Culture'];https://twitter.com/hardmaru/status/1075942918668529664;2020-12-02 00:42:02;GAN to generate machine learning papers;Jia-Bin Huang;https://mlart.co/item/gan-to-generate-machine-learning-papers;
2018-01-01;36;['Web App', 'Tutorial'];['Style Transfer', '3D'];['Culture', 'Education'];https://twitter.com/JeffDean/status/1022253073090011136?s=20;2020-12-02 00:42:24;3D Style Transfer;Alexander Mordvintsev, Nicola Pezzotti, Ludwig Schubert, Chris Olah;https://mlart.co/item/3d-style-transfer;
2018-01-01;36;Open Source;['Style Transfer', '3D'];Art;https://twitter.com/zzznah/status/1025424887131844608?s=20;2020-12-02 00:42:31;Fast 3D Style Transfer;Agisoft;https://mlart.co/item/fast-3d-style-transfer;
2018-01-01;36;Image;['Gradient Ascent', 'DeepDream'];['Art', 'Minimalism', 'Education', 'Texture'];https://twitter.com/zzznah/status/1062342407906381824;2020-12-02 00:42:38;Explore CNN activations and turn them into patterns;Google Arts & Culture Lab, Pinar&Viola, Alexander Mordvintsev;https://mlart.co/item/explore-cnn-activations-and-turn-them-into-patterns;
2018-01-01;36;Image;Super-Resolution;['Texture', 'Art', 'Pixel Art'];https://twitter.com/zzznah/status/1034114823896883201?s=20;2020-12-02 00:42:45;Reverse Super-Resolution by turning high-res images into low-res;Alexander Mordvintsev;https://mlart.co/item/reverse-super-resolution-by-turning-high-res-images-into-low-res;
2018-01-01;36;['Image', 'Visualization'];['t-SNE', 'VR'];Education;https://twitter.com/zzznah/status/1075884841177092096?s=20;2020-12-02 00:42:52;t-SNE exploration in VR;Alexander Mordvintsev;https://mlart.co/item/t-sne-exploration-in-vr;
2018-01-01;36;Image;DeepDream;['Art', 'Art Nouveau'];https://www.instagram.com/p/BeoPN8xAA_8/;2020-12-02 00:42:59;DeepDream applied to Klimt's Adele Bloch-Bauer;Alexander Mordvintsev;https://mlart.co/item/deepdream-applied-to-klimt_s-adele-bloch-bauer;
2018-01-01;36;['Device', 'Game'];['RNN', 'Microphone'];Sound;https://experiments.withgoogle.com/sound-teddy;2020-12-02 00:43:07;An RNN analysis sound data to control a video game;Støj, Google Creative Lab;https://mlart.co/item/an-rnn-analysis-sound-data-to-control-a-video-game;
2018-01-01;36;Web App;['VAE', 'Magenta'];Music;https://experiments.withgoogle.com/melody-mixer;2020-12-02 00:43:14;Blend two melodies using the latent vectors from a VAE;Torin Blankensmith, Kyle Phillips, Google Creative Lab;https://mlart.co/item/blend-two-melodies-using-the-latent-vectors-from-a-vae;
2018-01-01;36;Web App;['VAE', 'Magenta'];Music;https://experiments.withgoogle.com/beat-blender;2020-12-02 00:43:37;Blend several beats melodies by mixing the latent vector of MIDI files;Magenta, Google Creative Lab;https://mlart.co/item/blend-several-beats-melodies-by-mixing-the-latent-vector-of-midi-files;
2018-01-01;36;['Game', 'App'];['Camera', 'CNN', 'Classification'];Culture;https://experiments.withgoogle.com/emoji-scavenger;2020-12-02 00:43:45;Use a camera to find objects and a CNN identifies if it's correct;Google Brand Studio;https://mlart.co/item/use-a-camera-to-find-objects-and-a-cnn-identifies-if-it_s-correct;
2018-01-01;36;Textile;RNN;Culture;https://experiments.withgoogle.com/skyknit;2020-12-02 00:43:53;An RNN that generates knitting instructions, then a knitter follows the instructions;Janelle Shane, Google;https://mlart.co/item/an-rnn-that-generates-knitting-instructions_-then-a-knitter-follows-the-instructions;
2018-01-01;36;Web App;['RNN', 'QuickDraw'];Culture;https://experiments.withgoogle.com/scrying-pen;2020-12-02 00:44:00;A real time implementation of Sketch RNN which predicts future strokes while you draw;Andy Matuschak, Google;https://mlart.co/item/a-real-time-implementation-of-sketch-rnn-which-predicts-future-strokes-while-you-draw;
2018-01-01;36;['Web App', 'Game'];Semantic search;Culture;https://experiments.withgoogle.com/semantris;2020-12-02 00:44:07;Word association games powered by semantic search;Google AI;https://mlart.co/item/word-association-games-powered-by-semantic-search;
2018-01-01;36;['Font', 'Graphics', 'Tool'];['NNS', 'CNN'];Design;https://experiments.withgoogle.com/fontjoy;2020-12-02 00:44:14;Generate font combinations by matching the CNN features of fonts;Jack Qiao;https://mlart.co/item/generate-font-combinations-by-matching-the-cnn-features-of-fonts;
2018-01-01;36;Web App;['PoseNet', 'Camera'];['Dance', 'Culture'];https://experiments.withgoogle.com/move-mirror;2020-12-02 00:44:22;Extract the pose from a picture and match it with an image with the same pose;Google Creative Lab;https://mlart.co/item/extract-the-pose-from-a-picture-and-match-it-with-an-image-with-the-same-pose;
2018-01-01;36;Web App;['RNN', 'NNS'];['Books', 'Culture', 'Language'];https://experiments.withgoogle.com/talk-to-books;2020-12-02 00:44:29;Turn book paragraphs into an RNN features and match them with similar paragraphs;Google AI;https://mlart.co/item/turn-book-paragraphs-into-an-rnn-features-and-match-them-with-similar-paragraphs;
2018-01-01;36;Web App;['RNN', 'Classification', 'QuickDraw'];Culture;https://experiments.withgoogle.com/scribbling-speech;2020-12-02 00:44:49;Classify voice with an RNN and match it with doodles;Xinyue Yang;https://mlart.co/item/classify-voice-with-an-rnn-and-match-it-with-doodles;
2018-01-01;36;Web App;['CNN', 'Classification'];Culture;https://experiments.withgoogle.com/cartoonify;2020-12-02 00:44:56;Classify a photo and match it with a doodle;Eric Lu;https://mlart.co/item/classify-a-photo-and-match-it-with-a-doodle;
2018-01-01;36;['Video', 'Web App'];['CNN', 'NNS'];['Streetview', 'Sound'];https://experiments.withgoogle.com/imaginary-soundscape;2020-12-02 00:45:04;Turn images into sound by matching CNN features with CNN features of audio files;Nao Tokui;https://mlart.co/item/turn-images-into-sound-by-matching-cnn-features-with-cnn-features-of-audio-files;
2018-01-01;36;Web App;['PoseNet', 'Camera'];Music;https://experiments.withgoogle.com/semi-conductor;2020-12-02 00:45:11;Conduct your own orchestra by extracting your pose;Google Creative Lab;https://mlart.co/item/conduct-your-own-orchestra-by-extracting-your-pose;
2018-01-01;36;Image;GAN;['Art', 'Ukiyo-e'];http://www.aiartonline.com/community/hello-world/;2020-12-02 00:45:18;GAN generated images of Edo woodblock art;Michael Kelly;https://mlart.co/item/gan-generated-images-of-edo-woodblock-art;
2018-01-01;36;Image;GAN;Food;http://www.aiartonline.com/design/ryosuke-tanno/;2020-12-02 00:45:25;GAN generated images of Japanese Anime Food I;Ryosuke Tanno;https://mlart.co/item/gan-generated-images-of-japanese-anime-food-i;
2018-01-01;36;['Demo', 'Bot', 'Video'];['Voice Detection', 'IoT', 'Hardware'];['Humour', 'Culture'];http://www.aiartonline.com/art/nadine-lessio/;2020-12-02 00:45:34;Use Alexa voice assistants and add heuristics for it to disagree;Nadine Lessio;https://mlart.co/item/use-alexa-voice-assistants-and-add-heuristics-for-it-to-disagree;
2018-01-01;36;Web App;['VAE', 'Magenta'];Music;http://www.aiartonline.com/music/tero-parviainen/;2020-12-02 00:45:41;Mix latent space of sounds using wheels;Tero Parviainen;https://mlart.co/item/mix-latent-space-of-sounds-using-wheels;
2018-01-01;36;Device;['Hardware', 'CNN', 'RNN'];Robotics;http://www.aiartonline.com/art/jeff-thompson/;2020-12-02 00:46:24;Generative touch with a robotic arm, translating image features to movements;Jeff Thompson;https://mlart.co/item/generative-touch-with-a-robotic-arm_-translating-image-features-to-movements;
2018-01-01;36;Image;GAN;['Bias', 'Discrimination', 'Surveillance'];http://www.aiartonline.com/community/nushin-isabelle-yazdani/;2020-12-02 00:46:31;Generative images of convicts using a GAN;Nushin Isabelle Yazdani;https://mlart.co/item/generative-images-of-convicts-using-a-gan;
2018-01-01;36;['Visualization', 'Video'];Object Detection;Education;http://www.aiartonline.com/art/francois-quevillon/;2020-12-02 00:46:38;Visualize the Object Detection ability of footage from a self-driving car;François Quévillon;https://mlart.co/item/visualize-the-object-detection-ability-of-footage-from-a-self-driving-car;
2018-01-01;36;Video;['GAN', 'Inpainting'];Religion;http://www.aiartonline.com/art/ziv-epstein-matt-groh-manuel-cebrian-iyad-rahwan/;2020-12-02 00:46:45;Use GAN inpaintings to add spirits to videos;Ziv Epstein, Matt Groh, Manuel Cebrian, Iyad Rahwan;https://mlart.co/item/use-gan-inpaintings-to-add-spirits-to-videos;
2018-01-01;36;Video;['Microphone', 'RNN', 'Classification'];['Culture', 'Discrimination'];http://www.aiartonline.com/art/libby-heaney/;2020-12-02 00:46:52;Use voice and text features to match it with Britain's citizen test;Libby Heaney;https://mlart.co/item/use-voice-and-text-features-to-match-it-with-britain_s-citizen-test;
2018-01-01;36;Image;GAN;['Art', 'Surrealism'];http://www.aiartonline.com/art/robbie-barrat/;2020-12-02 00:46:59;GAN generated nude portraits inspired by Francis Bacon and Sol Lewitt;Robbie Barrat;https://mlart.co/item/gan-generated-nude-portraits-inspired-by-francis-bacon-and-sol-lewitt;
2018-01-01;36;['Book', 'Visualization'];Face recognition;['Culture', 'Discrimination'];http://www.aiartonline.com/community/aarati-akkapeddi/;2020-12-02 00:47:06;Visualizing face-recognition data;Aarati Akkapeddi;https://mlart.co/item/visualizing-face-recognition-data;
2018-01-01;36;Image;['CycleGAN', 'GAN'];Nature;http://www.aiartonline.com/community/albert-jimenez-adria-romero-lopez-mohamed-akrout-stephen-solis-reyes-anirudh-challa/;2020-12-02 00:47:13;Use CycleGAN to turn Mars' surface into earth-like;Albert Jimenez, Adria Romero-Lopez, Mohamed Akrout, Stephen Solis-Reyes, Anirudh Challa;https://mlart.co/item/use-cyclegan-to-turn-mars_-surface-into-earth-like;
2018-01-01;36;Installation;PoseNet;Dance;http://www.aiartonline.com/community/datadada/;2020-12-02 00:47:34;Train a model to map a gesture to a sound;DataDada;https://mlart.co/item/train-a-model-to-map-a-gesture-to-a-sound;
2018-01-01;36;Image;GAN;['Art', 'Surrealism'];http://www.aiartonline.com/community/albert-jimenez/;2020-12-02 00:47:41;GAN generative images based on Dali;Albert Jimenez;https://mlart.co/item/gan-generative-images-based-on-dali;
2018-01-01;36;['Theatre', 'Bot'];Voice detection;Culture;http://www.aiartonline.com/art/kory-mathewson-and-piotr-mirowski/;2020-12-02 00:47:47;Use a Turing Test chatbot to guide an improvisational theatre act;Kory Mathewson, Piotr Mirowski;https://mlart.co/item/use-a-turing-test-chatbot-to-guide-an-improvisational-theatre-act;
